{
  "version": "1.0",
  "missionId": "XB01-P2",
  "baseSha": "8a1a0bfa7878603dd488db98568577b2fb1896da",
  "requirementIds": ["XB01-C007"],
  "state": "IN_PROGRESS",
  "risk": "high",
  "scope": "Founder-approved Phase2 only. All ten original007 criteria, finite73 packets, tenant/parent/account/worker lineage and genuine proof. No008/009/010 implementation or production authority.",
  "changedFiles": [
    "backend/src/ai/pipeline.ts",
    "backend/src/ai/runStore.ts",
    "backend/src/security/workerProjectAdmission.test.ts",
    "backend/src/security/workerProjectAdmission.local.integration.ts",
    "supabase/migrations/20261019000300_worker_database_project_admission.sql",
    "backend/src/routes/swarm.ts",
    "backend/src/security/ownership.ts",
    "backend/src/security/ownership.test.ts",
    "backend/src/security/tenantIsolation.integration.test.ts",
    "backend/src/security/tenantIsolation.local.integration.ts",
    "backend/src/security/chatBoundary.local.integration.ts",
    "docs/xroga/batch-1/phases/PHASE-2-ACCESS-MATRIX.md",
    "frontend/src/app/api/release/route.ts",
    "frontend/src/lib/releaseIdentity.ts",
    "frontend/src/lib/releaseIdentity.test.ts",
    "backend/src/ai/universal/resumeProjectContext.test.ts",
    "backend/src/growth/growthService.ts",
    "backend/src/growth/growthService.identity.test.ts",
    "backend/src/growth/identityParentAdmission.test.ts",
    "backend/src/growth/identity.local.integration.ts",
    "backend/src/growth/eventParentAdmission.test.ts",
    "backend/src/growth/eventReplay.test.ts",
    "backend/src/growth/eventReplay.local.integration.ts",
    "backend/src/growth/growthService.boundary.test.ts",
    "backend/src/growth/growthService.referralBoundary.test.ts",
    "supabase/migrations/20261019000100_growth_event_parent_admission.sql",
    "backend/src/security/provisioningReceipt.local.integration.ts",
    "backend/src/services/integrations/githubTokenStore.ts",
    "backend/src/services/integrations/userProviderKeys.ts",
    "backend/src/services/integrations/supabaseBundle.authority.test.ts",
    "backend/src/services/integrations/supabaseBundle.test.ts",
    "backend/src/security/supabaseBundle.local.integration.ts",
    "backend/src/services/integrations/absentCredentialAuthority.test.ts",
    "backend/src/services/integrations/githubAuth.revocation.test.ts",
    "backend/src/services/integrations/credentialMirrorRace.test.ts",
    "backend/src/ai/buildOutcomeMemory.ts",
    "backend/src/ai/buildOutcomeMemory.test.ts",
    "backend/src/ai/buildOutcomeOwnership.test.ts",
    "backend/src/security/buildOutcomeAttempt.local.integration.ts",
    "scripts/security/full-supabase-history.mjs",
    "scripts/security/schema-catalog.mjs",
    "scripts/security/schema-catalog.test.mjs",
    "scripts/security/audit-tenant-policies.mjs",
    "scripts/security/audit-tenant-policies.test.mjs",
    "docs/xroga/security/disposable-catalog-reference.json",
    "scripts/security/tenant-rls.database.test.mjs",
    "supabase/migrations/20261018002000_browser_table_privileges.sql",
    "supabase/migrations/20261018002100_legacy_server_table_rls.sql",
    "supabase/migrations/20261018002200_growth_identity_parent_admission.sql",
    "scripts/ci/run-baseline.mjs",
    ".github/workflows/unit-tests.yml",
    "scripts/xroga/phase-one.mjs",
    "scripts/xroga/phase-one.test.mjs",
    "scripts/xroga/phase-two.mjs",
    "scripts/xroga/phase-two.test.mjs",
    "docs/xroga/batch-1/phases/PHASE-2-ACCEPTANCE.md"
  ],
  "decisions": {
    "keep": ["Phase1 source/evidence and frozen371 identities", "Canonical context, resource ownership, worker attempt fences, budget and approval systems"],
    "extend": ["Source-bound semantic proof and actual migration/catalog evidence", "Existing owner/run association and endpoint admission"],
    "replace": ["Run-only telemetry association with exact owner/run binding", "Ambiguous disposable source labels with actual checkout attestation"],
    "deprecate": ["Treating a historical pending-CI note as a new vulnerability", "Treating test names or source review counts as whole-workflow acceptance"]
  },
  "schemaImpact": {"changed":true,"migrations":["supabase/migrations/20261018002000_browser_table_privileges.sql","supabase/migrations/20261018002100_legacy_server_table_rls.sql","supabase/migrations/20261018002200_growth_identity_parent_admission.sql","supabase/migrations/20261019000100_growth_event_parent_admission.sql","supabase/migrations/20261019000200_provider_budget_cycle_parent.sql","supabase/migrations/20261019000300_worker_database_project_admission.sql"],"rollout":"Disposable CI only. Revoke browser whole-table privileges, enable13 omitted legacy server-only RLS boundaries and extend the existing current-parent growth transaction pattern to identity linking. No row rewrite, owner-column/constraint tightening, production DDL or orphan remediation. Default grant changes cover the migration creator, not all future creators. Event creation and replay use current-parent transaction admission, including release/deployment references. No new status restriction on historical analytics. Worker admission extends the existing nullable project FK and adds only current-owner guards on existing worker tables. No data backfill or constraint tightening. Preserve safe cancellation and FK deletion behavior.","rollback":"No data rewrite or new constraint to reverse. Preserve restrictive grant, RLS and current-parent admission. A code revert must not automatically re-grant unsafe browser rights, disable RLS or restore unguarded writes. Any production rollout or privilege rollback requires separate approval. Never restore independent event writes or replay without current admission. Disable the route if the RPC must be withdrawn. Withhold project-bound worker admission if this guard must be withdrawn. Preserve stored project bindings and never restore stale-preflight writes."},
  "securityImpact": {
    "auth": {"changed": false, "description": "Existing server authentication retained, no login/MFA/role bypass."},
    "tenant": {"changed": true, "description": "Exact owner/run evidence binding and independently verified parent admission. Strict ten-criterion gate remains blocked until real proof."},
    "approval": {"changed": false, "description": "No canonical authority replacement or new grant. Phase3 remains unstarted."},
    "credentials": {"changed": true, "description": "Earlier Phase2 orphan-mirror fixes restrict credential read admission when canonical authority is absent. No live token, key or vault change. Credential custody remains a separate original009 requirement."},
    "egress": {"changed": false, "description": "No provider call, publishing, message or external effect. Phase4 remains unstarted."},
    "cost": {"changed": false, "description": "Zero additional spend, existing standard public CI and local/disposable tests only."},
    "billing": {"changed": false, "description": "No payment, plan or production billing operation."}
  },
  "tests": [
    {"command": "node --import tsx --test backend/src/ai/buildOutcomeOwnership.test.ts backend/src/ai/buildOutcomeMemory.test.ts", "scope": "Owner/run positive and foreign-evidence denial, including a reproduced pre-fix failing test", "negative": true, "reference": "backend/src/ai/buildOutcomeOwnership.test.ts"},
    {"command": "node --test scripts/xroga/phase-one.test.mjs scripts/xroga/phase-two.test.mjs scripts/security/schema-catalog.test.mjs", "scope": "Frozen input preservation, finite current mapping, no fabricated certification and exact CI source attestation", "negative": true, "reference": "scripts/xroga/phase-two.test.mjs"},
    {"command": "node --import tsx --test src/security/tenantIsolation.local.integration.ts", "scope": "Real disposable owner/run evidence, tenant and concurrency regression", "negative": true, "reference": "backend/src/security/buildOutcomeAttempt.local.integration.ts"}
  ],
  "architecture": {"change": "extends_canonical", "reason": "Existing tenant context, owned resources and attempt-fenced stores only. No new orchestration, relation engine or vault.", "rfc": null},
  "rollout": "Draft PR803 only, no merge or deploy. Full source-bound acceptance required before Phase2 verification.",
  "rollback": "Revert scoped new entry-point commits while preserving all Phase1 work, old receipts and customer state. Never drop tables, delete credentials or remove existing worker fences.",
  "knownGaps": ["All ten007 criteria await complete real acceptance", "Unchanged proof reconciliation and remaining frozen packets", "ActualR2 and production parity are separately unverified", "Authority/custody/egress implementation stays Phases3/4"],
  "placeholderClaimsRemaining": [],
  "evidenceRefs": ["docs/xroga/batch-1/phases/PHASE-2-ACCEPTANCE.md", "docs/xroga/batch-1/phases/PHASE-2-FROZEN-WORKLIST.json"],
  "claimsFullProductCompletion": false,
  "claimsAllBatchCommandsComplete": false,
  "release": {"state": "BLOCKED", "blockers": ["Original007-010 acceptance and production approval remain mandatory"], "authenticatedE2e": "BLOCKED", "stagedSecurity": "BLOCKED", "liveUrl": null, "deployedSha": null}
}
