{
  "version": "1.0",
  "missionId": "XB01-P3-MAIN-RECONCILIATION-20261023",
  "baseSha": "fb95f76bafc1b544b6655d435cddede260d9cd99",
  "requirementIds": ["XB01-C008", "XB01-C009"],
  "state": "IN_PROGRESS",
  "risk": "medium",
  "scope": "Separate current-main merge candidate preserving both Phase 3 and Phase 4 source history. Reconcile source conflicts, current UI regression contracts and the existing frontend dependency declaration. No production or Phase 4 admission.",
  "changedFiles": [
    "frontend/src/app/crypto/page.tsx",
    "frontend/src/components/terminal/WorkspaceLauncher.tsx",
    "frontend/src/components/homepage-next/s02/Theater.tsx",
    "frontend/src/components/homepage-next/s02/WorkforceStage.tsx",
    "frontend/src/components/homepage-next/s02/s02.test.ts",
    "frontend/src/components/icons/animated/animatedIcons.test.ts",
    "frontend/src/components/layout/mobileChrome.test.ts",
    "frontend/src/lib/sidebarAccountFlyouts.test.ts",
    "frontend/src/lib/sidebarCompactNav.test.ts",
    "frontend/src/lib/sidebarEdgeToggle.test.ts",
    "frontend/src/lib/sidebarHistoryScroll.test.ts",
    "frontend/src/lib/sidebarOwnerRls.test.ts",
    "frontend/src/lib/workspaceEmptyComposer.test.ts",
    "frontend/src/lib/workspaceFullscreen.test.ts",
    "frontend/src/lib/workspaceRouteIsolation20261021.test.ts",
    "frontend/src/lib/workspaceShellLayout.test.ts",
    "frontend/package-lock.json",
    "docs/xroga/current-state.json",
    "docs/xroga/current-state.md",
    "docs/xroga/research/source-manifest.json",
    "docs/xroga/research/source-reconciliation.md",
    "docs/xroga/security/phase3-main-reconciliation-20261023.md",
    "docs/xroga/missions/phase3-main-reconciliation-20261023.json"
  ],
  "decisions": {
    "keep": ["Both parent histories, canonical security mechanisms, current-main UI and separate stacked Phase 4 PR", "All original 22 criteria and historical evidence"],
    "extend": ["Combine empty-workspace visibility with scoped draft-preservation behavior", "Update tests to the actual inherited main controls without implementing another interface"],
    "replace": ["Conflicting duplicate component filenames with the identical current-main WorkforceStage name"],
    "deprecate": []
  },
  "schemaImpact": {"changed": false, "migrations": [], "rollout": "No SQL edit or database application in this reconciliation. Inherited parent migrations remain subject to original release gates.", "rollback": "No database operation to reverse. Preserve historical rows and accepted migration history."},
  "securityImpact": {
    "auth": {"changed": false, "description": "No authentication implementation or role grant in this code candidate."},
    "tenant": {"changed": false, "description": "Retain existing owner/session/project draft identity checks. RLS test excludes comments but retains executable ownership predicates."},
    "approval": {"changed": false, "description": "No authority or approval boundary changed. Original Phase 3 remains blocked."},
    "credentials": {"changed": false, "description": "Backend and credential implementation unchanged. Separate synthetic Google receipts do not authorize production cutover."},
    "egress": {"changed": false, "description": "No egress policy change. Phase 4 remains separate."},
    "cost": {"changed": false, "description": "No new application runtime resource or provider call introduced by reconciliation."},
    "billing": {"changed": false, "description": "No billing feature or paid upgrade. External synthetic verification has separate bounded founder approval and cleanup receipts."}
  },
  "tests": [
    {"command": "Focused tsx frontend test run across nine reconciliation files", "scope": "131 passed, zero failed. Positive and negative source contracts, project resume, composer preservation and ownership assertions.", "negative": true, "reference": "frontend/src/lib/workspaceEmptyComposer.test.ts"},
    {"command": "TypeScript no emit, frontend lint and canonical credential-free production build", "scope": "Local candidate compile/build, warnings retained. Not deployed UI or authenticated production proof.", "negative": false, "reference": "frontend/src/components/terminal/WorkspaceLauncher.tsx"},
    {"command": "npm ci --dry-run --ignore-scripts --workspaces=false --no-audit --no-fund", "scope": "Standalone frontend manifest/lock consistency only. Root actual frozen install and production build are separate local checks.", "negative": false, "reference": "frontend/package-lock.json"}
  ],
  "architecture": {"change": "none", "reason": "Existing components and canonical mechanisms only. No new vault, orchestrator, scheduler, policy engine or provider migration.", "rfc": null},
  "rollout": "Review branch and source-bound CI only. No merge, production deployment, database migration, customer credential migration, DNS change or Phase 4 implementation.",
  "rollback": "Reject the isolated candidate or revert reconciliation in a new review commit. Preserve both original PR branches and parent evidence. No live state changed by the code candidate.",
  "knownGaps": ["Exact candidate CI pending", "Existing main unit baseline has five growth-suite failures", "Original production custody/caller cutover and applicable full isolated Supabase/staged verification remain blocked", "No founder Phase 3 acceptance or Phase 4 admission"],
  "placeholderClaimsRemaining": ["No final-source CI or production acceptance claim"],
  "evidenceRefs": ["docs/xroga/security/phase3-main-reconciliation-20261023.md", "docs/xroga/batch-1/phases/PHASE-3-FROZEN-WORKLIST.json"],
  "claimsFullProductCompletion": false,
  "claimsAllBatchCommandsComplete": false,
  "release": {"state": "BLOCKED", "blockers": ["Exact candidate source-bound CI pending", "Original production cutover and staged acceptance gates unresolved"], "authenticatedE2e": "BLOCKED", "stagedSecurity": "BLOCKED", "liveUrl": null, "deployedSha": null}
}
