{
  "version": "1.0",
  "missionId": "B15-WORKSPACE-DRIVE-ACTIVATION-20261031",
  "baseSha": "0d270ec69bdcf130ff85ce27f524e1d0d1e59e23",
  "requirementIds": [
    "XR-FAMILY-user-intent-relevance"
  ],
  "state": "CODE_COMPLETE",
  "risk": "low",
  "scope": "Issue 898 scope freeze: expose the existing private Drive from Workspace and Library. No browser runtime implementation, Batch 2, API/Job release or new infrastructure.",
  "changedFiles": [
    "frontend/src/components/layout/Sidebar.tsx",
    "frontend/src/components/library/LibraryWorkspace.tsx",
    "frontend/src/components/terminal/ChatBarActionsMenu.tsx",
    "frontend/src/lib/sidebarCompactNav.test.ts",
    "docs/xroga/missions/b15-workspace-drive-activation-20261031.json",
    "docs/xroga/current-state.json",
    "docs/xroga/current-state.md",
    "docs/xroga/security/caller-reviews.json",
    "docs/xroga/evidence/b15-workspace-activation-20261031/array-conversion-binding.json",
    "docs/xroga/security/egress-callers.json",
    "docs/xroga/security/privileged-callers.json",
    "docs/xroga/research/source-manifest.json",
    "frontend/src/lib/formatAiMarkdown.test.ts"
  ],
  "decisions": {
    "keep": [
      "Existing Drive flag, authenticated route, private storage and backend controls",
      "Live microphone and research source behavior",
      "Browser Worker flag remains disabled"
    ],
    "extend": [
      "Existing Workspace and Library navigation to /drive when enabled",
      "Refresh generated inventory and bind one unchanged native array conversion using existing projection validator. No audit rule or disposition changes."
    ],
    "replace": [
      "Incorrect Drive unavailable copy"
    ],
    "deprecate": []
  },
  "schemaImpact": {
    "changed": false,
    "migrations": [],
    "rollout": "No SQL.",
    "rollback": "No data changes."
  },
  "securityImpact": {
    "auth": {
      "changed": false,
      "description": "Existing controls and configuration preserved."
    },
    "tenant": {
      "changed": false,
      "description": "Existing controls and configuration preserved."
    },
    "approval": {
      "changed": false,
      "description": "Existing controls and configuration preserved."
    },
    "credentials": {
      "changed": false,
      "description": "Existing controls and configuration preserved."
    },
    "egress": {
      "changed": false,
      "description": "Existing controls and configuration preserved."
    },
    "cost": {
      "changed": false,
      "description": "Existing controls and configuration preserved."
    },
    "billing": {
      "changed": false,
      "description": "Existing controls and configuration preserved."
    }
  },
  "tests": [
    {
      "command": "tsx --tsconfig frontend/tsconfig.json --test frontend/src/lib/sidebarCompactNav.test.ts frontend/src/lib/driveApiContract.test.ts",
      "scope": "22 focused navigation, Drive API contract, CSP, compact controls and auth-gate tests PASS. Local receipt 889971e3-177e-42aa-b00a-433f4e2d40a5. Changed-component lint PASS receipt 297461f0-09b8-4e0d-900c-5ed6d4488682. Mission policy PASS receipt c047e5ff-6347-40f2-97ba-07d79cb9eac7. Frontend typecheck PASS receipt 29a3e1b5-c83e-42bf-a975-ac082e79fc9d. Exact frontend build passed GitHub run 41229848958 at a32411fa. Final shortcut source a3c3b53b frontend build PASS in run 41231395426. After Preview exposed collapsed-rail interception, the Drive-only bypass and regression pass in 23 focused tests, receipt 45f8f6cd-abaa-43d3-ad4a-86b987bb4407.",
      "negative": true,
      "reference": "frontend/src/lib/driveApiContract.test.ts"
    },
    {
      "command": "tsx --tsconfig frontend/tsconfig.json --test frontend/src/**/*.test.ts",
      "scope": "All 1310 frontend tests PASS, zero failed or skipped. Receipt dbead5b8-afa1-4c4f-b3c7-1c3dd30a10f9. Two baseline markdown expectations corrected to preserve the already-live source attribution URLs. No renderer behavior changed.",
      "negative": true,
      "reference": "frontend/src/lib/formatAiMarkdown.test.ts"
    }
  ],
  "architecture": {
    "change": "extends_canonical",
    "reason": "Navigation to existing storage route only.",
    "rfc": null
  },
  "rollout": "Verify narrow source and Preview, then promote only this frontend. Preserve API/Job and browser flag.",
  "rollback": "Restore Vercel deployment AFieb6wDdFosSFt5hW2Ufa2rctL4 at 0d270ec69bdcf130ff85ce27f524e1d0d1e59e23.",
  "knownGaps": [
    "Browser Worker production host has not been demonstrated through Xroga. Advanced browser implementation deferred by founder."
  ],
  "placeholderClaimsRemaining": [],
  "claimsFullProductCompletion": false,
  "claimsAllBatchCommandsComplete": false,
  "release": {
    "state": "BLOCKED",
    "blockers": [
      "Final exact-source CI and production promotion pending"
    ],
    "authenticatedE2e": "BLOCKED",
    "stagedSecurity": "NOT_APPLICABLE",
    "liveUrl": null,
    "deployedSha": null
  },
  "evidenceRefs": [
    "frontend/src/lib/driveApiContract.test.ts",
    "frontend/src/lib/sidebarCompactNav.test.ts",
    "docs/xroga/evidence/b15-workspace-activation-20261031/array-conversion-binding.json"
  ]
}
