{
  "version": "1.0",
  "missionId": "BATCH2-BUILDER-UNIVERSAL-ROUTING-20261028",
  "baseSha": "b496482af907b9182059261ecfdc9242e6b7ec20",
  "requirementIds": [
    "XR-FAMILY-schedulers"
  ],
  "state": "CODE_COMPLETE",
  "risk": "medium",
  "scope": "A live authenticated build for a new Builder project (not on the allowlist) took the legacy path at the 0% universal rollout and failed in 2 seconds: the legacy path writes only to a connected repository and a Builder project has none. Route server-bound Builder runs to the universal path; the operator off, legacy and shadow modes still take precedence, and a missing project id still shadows.",
  "changedFiles": [
    "backend/src/ai/pipeline.ts",
    "backend/src/config/universalAgentFlags.test.ts",
    "backend/src/config/universalAgentFlags.ts",
    "backend/src/synthesis/reliability/legacyRetirement.test.ts",
    "docs/xroga/batch-1/phases/PHASE-2-CLOSURE-LEDGER.json",
    "docs/xroga/batch-1/phases/PHASE-2-REVIEW-DECISIONS.json",
    "docs/xroga/current-state.json",
    "docs/xroga/current-state.md",
    "docs/xroga/dependency-inventory.json",
    "docs/xroga/missions/builder-universal-routing-20261028.json",
    "docs/xroga/research/source-manifest.json",
    "docs/xroga/security/caller-reviews.json",
    "docs/xroga/security/privileged-callers.json",
    "docs/xroga/security/rls-audit.md"
  ],
  "decisions": {
    "keep": [
      "Operator kill switch modes off, legacy and shadow",
      "Percentage rollout and allowlist for non-Builder projects"
    ],
    "extend": [
      "Server-bound Builder runs route to the universal path"
    ],
    "replace": [],
    "deprecate": []
  },
  "schemaImpact": {
    "changed": false,
    "migrations": [],
    "rollout": "No SQL or schema change.",
    "rollback": "Revert the commit and redeploy the previous image."
  },
  "securityImpact": {
    "auth": {
      "changed": false,
      "description": "No change."
    },
    "tenant": {
      "changed": false,
      "description": "No change."
    },
    "approval": {
      "changed": false,
      "description": "No new authority. The builder binding is still created only by trusted server code after ownership is resolved."
    },
    "credentials": {
      "changed": false,
      "description": "No change."
    },
    "egress": {
      "changed": false,
      "description": "No egress change; the line goes to the existing process log only."
    },
    "cost": {
      "changed": false,
      "description": "No change; the iteration cap still bounds model calls."
    },
    "billing": {
      "changed": false,
      "description": "No change."
    }
  },
  "tests": [
    {
      "command": "npx tsx --test src/config/universalAgentFlags.test.ts src/ai/softwareAgent/agentV2LaunchGate.test.ts src/synthesis/*.test.ts (in backend)",
      "scope": "Builder-bound run is universal at 0% rollout; off, legacy and shadow modes and a missing project id still refuse. 648 PASS, 0 FAIL.",
      "negative": true,
      "reference": "backend/src/config/universalAgentFlags.test.ts"
    }
  ],
  "architecture": {
    "change": "extends_canonical",
    "reason": "Adds a limit and a log line to the existing SoftwareAgent executor. No new orchestrator or control plane.",
    "rfc": null
  },
  "rollout": "Merge after required checks, build the release image, create a 0% revision, switch traffic with the Job, then repeat the authenticated build.",
  "rollback": "Revert the commit and redeploy; restore the previous service revision and Job image and label.",
  "knownGaps": [
    "Preview, QA and external delivery remain separate gates"
  ],
  "placeholderClaimsRemaining": [
    "Batch 2 building is not accepted until a live authenticated build saves a revision"
  ],
  "claimsFullProductCompletion": false,
  "claimsAllBatchCommandsComplete": false,
  "release": {
    "state": "BLOCKED",
    "blockers": [
      "Required CI checks and merge",
      "Release image build and deploy",
      "Live authenticated Batch 2 build evidence"
    ],
    "authenticatedE2e": "BLOCKED",
    "stagedSecurity": "BLOCKED",
    "liveUrl": null,
    "deployedSha": null
  },
  "evidenceRefs": [
    "backend/src/config/universalAgentFlags.test.ts"
  ]
}
